ows_LinkTitle,ows_Zona,ows_Georeferencia,ows_CodigoPostal,ows_Direccion,ows_Telefono,ows_Fax,ows_Web,ows_FechaActualizacion,ows_Situacion,ows_ObservacionesSituacion,ows_DescripcionEspanol,ows_DescripcionIngles,ows_DescripcionAleman,ows_TipoActividad,ows_Actividad,ows_Email,ows_Municipio,ows_Image,ows_Recomendado,ows_DescripcionRuso,ows_DescripcionItaliano,ows_Dificultad,ows_Peligrosidad,ows_ComoLlegarEspanol,ows_ComoLlegarIngles,ows_ComoLlegarAleman,ows_ComoLlegarFrances,ows_ComoLlegarItaliano
"Parque Natural Corona Forestal","","","38300","","","","","2014-04-07 16:04:57","","Este espacio comprende buena parte de la estructura cónica que corona la isla, con la excepción de la caldera de las Cañadas y el edificio Teide - Pico Viejo. Entre sus grandes unidades geomorfológicas destacan enormes barrancos y gigantescas estructuras como el valle de La Orotava y el de Güímar.  Todo el parque está ocupado por una de las mejores masas forestales de Canarias, donde predomina el pinar y buenas muestras de fayal - brezal. Toda esa masa forestal ofrece un paisaje de bosques de pino canario, con algunas poblaciones muy antiguas y de gran valor. Un espacio que cuenta con lugares de interés como el campamento Madre del Agua, el de Arenas Negras...  ","","","","Monumento natural","Naturaleza y Monumentos","","Orotava (La)","","","","","Bajo","Bajo","","","","",""
"Acantilados de la Isorana","Sur","(28.1574425, -16.793377599999985)","38680","Playa San Juan","","","","2014-02-14 11:37:56","","","","","","Monumento natural","Naturaleza y Monumentos","","Guía de Isora","../PublishingImages/acantilados la isorana.jpg","","","","Bajo","Bajo","","","","",""
"Montaña de Tejina","Sur","(28.1867158, -16.76509740000006)","38685","Tejina","","","","2014-02-14 11:29:16","","","","","","Monumento natural","Naturaleza y Monumentos","","Guía de Isora","../PublishingImages/montaña tejina.jpg","","","","Bajo","Bajo","","","","",""
"Paisaje protegido Barranco de Erques","Sur","(28.1746896, -16.743741999999997)","38680","Vera de Erques","","","","2014-02-14 11:30:13","","","","","","Monumento natural","Naturaleza y Monumentos","","Guía de Isora","../PublishingImages/barranco erques.jpg","","","","Bajo","Bajo","","","","",""
"Mirador de la Cruz de Hilda","Isla Baja","(28.313032966248542, -16.845731735229492)","38480","Carretera de Masca TF-436 KM 14,500","","","","2014-04-16 12:18:09","","","Se trata de un mirador cercano al Caserío de Masca desde el que se observa una parte del caserío y numerosos aspectos geológicos y de flora y fauna.","","","Monumento natural","Naturaleza y Monumentos","","Buenavista del Norte","../PublishingImages/imagen 455.JPG","","","","Bajo","Bajo","Desde la Carretera de Masca TF-436 a la altura del punto kilométrico 14,500 se encuentra la señalización del lugar.","","","",""