PK;NOMBRE;DESCRIPCION-ENTIDAD;HORARIO;EQUIPAMIENTO;TRANSPORTE;DESCRIPCION;ACCESIBILIDAD;CONTENT-URL;NOMBRE-VIA;CLASE-VIAL;TIPO-NUM;NUM;PLANTA;PUERTA;ESCALERAS;ORIENTACION;LOCALIDAD;PROVINCIA;CODIGO-POSTAL;BARRIO;DISTRITO;COORDENADA-X;COORDENADA-Y;LATITUD;LONGITUD;TELEFONO;FAX;EMAIL;TIPO;
2071;"Arte Público (Museo al Aire Libre de la Castellana)";"";"";"";" Metro: Rubén Darío (línea 5)  Bus: 5, 14, 27, 45, 150 ";"";"1";"http://www.madrid.es/vgn-ext-templating/v/index.jsp?vgnextchannel=9e4c43db40317010VgnVCM100000dc0ca8c0RCRD&vgnextoid=eca9ef4d7f71c010VgnVCM1000000b205a0aRCRD";"CASTELLANA";"PASEO";"V";"40";"";"";"";"";"MADRID";"MADRID";"28046";"CASTELLANA";"SALAMANCA";"441788";"4476277";"40.433219398671156";"-3.6876122680805956";"917 011 863  / 915 782 722 (información en Museo de Historia)";"";"smuseosm@madrid.es";"/contenido/entidadesYorganismos/MonumentosEdificiosArtisticos"; 
4949641;"Casa - Museo del Ratoncito Pérez";" La residencia de la familia Pérez está  situada en los sótanos de la confitería Prasi,  en el número ocho de la calle del Arenal, según cita Luis Coloma. ";"  Lunes  de 17 a 20 horas.  De martes a viernes de 11 a 14 horas y de 17 a 20 horas.  Sábados de 11 a 15 horas y de 16 a 20 horas (horario orientativo, consultar disponiblidad en la  web del Museo ).  Domingos y festivos de 12 a 18 horas.  ";"";" Metro: Sol (líneas: 1, 2 y 3)  Bus: 3, 50 ";" Venta de entradas directamente en el Museo   Recomendado a partir de los 5 años  Se recomienda sacar la entrada con antelación pues el aforo es limitado. ";"0";"http://www.madrid.es/vgn-ext-templating/v/index.jsp?vgnextchannel=9e4c43db40317010VgnVCM100000dc0ca8c0RCRD&vgnextoid=990950e86d4ca110VgnVCM2000000c205a0aRCRD";"ARENAL";"CALLE";"V";"8";"1º";"Local 15 - 16";"";"";"MADRID";"MADRID";"28013";"SOL";"CENTRO";"440254";"4474494";"40.41704834412296";"-3.7055288844865233";"915 226 968";"";"";"/contenido/entidadesYorganismos/Museos"; 
4847190;"Casa Museo Lope de Vega";"";" Para la visita es  imprescindible reserva anticipada  en:  casamuseolopedevega@madrid.org  o en el teléfono: 914 299 216, en horario del museo   De martes a domingo de 10 a 15 horas. Última visita a las 14 horas.  Cerrado los lunes, días 1 y 6 de enero, 5 de abril, 1 de mayo y 24, 25 y 31 de diciembre y dos festivos locales.  Este horario puede sufrir alteraciones por actividades extraordinarias que se celebran en este espacio. ";"";" Metro: Antón Martín (línea 1)   Bus: 6, 9, 10, 14, 26, 27, 32, 34, 37, 45, 57 ";" La visita se realiza en grupos de un máximo de 10 personas acompañados por un guía. Comienzan cada media hora y tienen una duración aproximada de 45 minutos (última visita a las 14 horas).   Idiomas: español, inglés y francés. ";"0";"http://www.madrid.es/vgn-ext-templating/v/index.jsp?vgnextchannel=9e4c43db40317010VgnVCM100000dc0ca8c0RCRD&vgnextoid=4eff8c46145e8110VgnVCM2000000c205a0aRCRD";"CERVANTES";"CALLE";"V";"11";"";"";"";"";"MADRID";"MADRID";"28014";"CORTES";"CENTRO";"440935";"4474190";"40.414358466555235";"-3.6974741545860015";"914 299 216";"914 292 601";"casamuseolopedevega@madrid.org";"/contenido/entidadesYorganismos/Museos"; 
5682031;"Castillo de la Alameda";"El edificio está incorporado al sistema &quot;museosdemadrid&quot; donde se realizan talleres para escolares y actividades en verano.";"  De abril a septiembre: sábados, domingos y festivos de 10 a 21 horas  De octubre a marzo: sábados, domingos y festivos de 10 a 18 horas  Cerrado los días 1 de enero, 1 de mayo y 25 de diciembre  ";"  Accesibilidad    Rampas de acceso  Servicios para minusválidos  Información en Braille para invidentes  ";" Metro: Alameda de Osuna (línea 5), El Capricho (línea 5)  Autobuses: 101, 105, 112, 114, 115 y 151 ";"  Descripción monumental   El monumento está clasificado como singular por el  PGOUM . Es uno de los escasos vestigios de la arquitectura militar del pasado siglo  XV , y uno de los pocos castillos que ha sobrevivido al paso del tiempo y resurge ahora, tras un minucioso proceso de restauración y conversión en Museo.  El lugar en el que se alza el Castillo de la Alameda o de Barajas, es un espacio donde están representadas todas las etapas de la historia de este territorio, situado entre Madrid y el valle del Jarama. Bajo él y su entorno, existen restos de asentamientos antiguos desde la Edad del Bronce hasta la época Romana.  Entre las aldeas medievales de la Alameda y Barajas, dentro del alfoz de Madrid, se construyó, en el siglo  XV , el castillo señorial, que en el siglo  XVI , se transformó en un palacio renacentista. Entre los siglos  XVI  y  XVIII , se alzan en esta zona varias villas de veraneo de la aristocracia madrileña. Entre ellas, el cercano palacete de los Duques de Osuna con su parque de El Capricho. Desde entonces, esta área se conoce con el nombre de la Alameda de Osuna.  La Guerra Civil también se deja sentir en este lugar, donde estaba situado el centro de mando del general Miaja, en la retaguardia del frente del Jarama. El mando de las operaciones estaba en el búnker de El Capricho, pero el castillo se empleó como fortín y a su lado existe un nido de ametralladoras.  La reciente urbanización del barrio ha respetado este lugar. Un parque público conserva dentro de él los vestigios de todas estas épocas: el poblado prehistórico, el castillo luego convertido en palacio, el cementerio y el panteón y el nido de ametralladoras.  El castillo y su entorno han sido objeto de varias campañas de excavaciones arqueológicas desde 1996, pero hasta ahora estas actuaciones no habían tenido continuidad ni habían constituido el germen de un proyecto que desembocase en la recuperación del yacimiento. ";"0";"http://www.madrid.es/vgn-ext-templating/v/index.jsp?vgnextchannel=9e4c43db40317010VgnVCM100000dc0ca8c0RCRD&vgnextoid=fe43c4be8e688210VgnVCM1000000b205a0aRCRD";"ANTONIO SANCHA";"CALLE";"V";"1";"";"";"";"";"MADRID";"MADRID";"28042";"ALAMEDA DE OSUNA";"BARAJAS";"449807";"4479009";"40.45835460563491";"-3.5932903820278788";"913 667 415                                     
";"";"castilloalameda@madrid.es";"/contenido/entidadesYorganismos/MonumentosEdificiosArtisticos"; 
2064;"Casón del Buen Retiro";" Edificio que forma parte del Museo Nacional del Prado, donde pueden consultarse fondos de la Biblioteca, del Archivo y del Servicio de Documentación de la colección del Museo y de otras fuentes relativas a la historia del arte. ";"  Mañanas    De lunes a jueves, de 9 a 15 horas. (Servicio de libros y otros materiales hasta las 14:30 horas)   Viernes, de 9 a 14:30 horas. (Servicio de libros y otros materiales hasta las 14 horas)     Tardes.  Lunes y miércoles, de 15 a 18 horas. (Servicio de libros y otros materiales hasta las 17:30 horas)   Horario de verano     Desde el 16 de junio al 15 de septiembre  Lunes a viernes, de 9 a 14:30 horas   ";"";" Metro: Atocha (Línea 1)  Bus: 19, 10, 14, 27, 34, 37, 45  Renfe: Atocha ";"  Descripción monumental   El Casón o Salón de Baile es el único volumen que permanece del antiguo Palacio del buen Retiro, ejecutado en 1637 con un proyecto de Alonso Carbonel. Aún se conserva la bóveda de cañon con lunetas, pintada al fresco por Lucas Jordán en 1692 con la Alegoría del Toisón de Oro. Su fachada principal, a poniente, arrasada la primitiva en 1886 por un ciclón, es de Velázquez Bosco. La última rehabilitación ha sido realizada por Jaime Torruell.   Otras direcciones de Correo electrónico:    documentacion@museodelprado.es    archivo@museodelprado.es  ";"0";"http://www.madrid.es/vgn-ext-templating/v/index.jsp?vgnextchannel=9e4c43db40317010VgnVCM100000dc0ca8c0RCRD&vgnextoid=f0443d0b5e71c010VgnVCM1000000b205a0aRCRD";"ALFONSO XII";"CALLE";"V";"28";"";"";"";"";"MADRID";"MADRID";"28014";"LOS JERONIMOS";"RETIRO";"441635";"4474285";"40.415263749471535";"-3.689232811717636";"902 107 077";"";"biblioteca@museodelprado.es";"/contenido/entidadesYorganismos/MonumentosEdificiosArtisticos"; 
103331;"Centro Social y Cultural la Casa Encendida";" Edificio de carácter monumental. De estilo neomudéjar, fue diseñado por el arquitecto Fernando Arbós e inaugurado en el año 1913. Cuenta con más de 6.000 metros cuadrados de instalaciones divididas en 4 plantas y una azotea. ";"  De lunes a domingo de 10 a 22 horas (todos los días del año, excepto festividades nacionales y de la Comunidad de Madrid)  Exposiciones: de 10 a 21:45 horas  ";"   Biblioteca  (consulta catálogo  http://catalogo.bibliotecas.obrasocialcajamadrid.es/ )   Sala de consulta y Hemeroteca: de lunes a domingos, de 10 a 21:15 horas  Mediateca y Sala de trabajo Ofimática: de lunes a domingos, de 10 a 21:15 horas  Biblioteca joven: de lunes a viernes, de 10 a 20:30, sábados y domingos de 10 a 13:30  Bebeteca: sábados y domingos de 10 a 13:30 horas     Estudio multimedia : cuenta con equipos profesionales para la edición de video con Final Cut Studio, Premiere, etc. Su uso tendrá un precio de cinco a ocho euros por turno de cinco horas dependiendo del tipo de asistencia técnica.   Laboratorio de radio:  dispone de un equipo completo de grabación y equipamiento profesional. Su uso tendrá un precio de diez euros por turnos de cinco horas.   Laboratorio fotográfico    Tienda solidaria:  consultar horario   Cafetería:  todos los días, excepto festivos, de 10 a 21:45 horas  ";" Metro: Embajadores (línea 3), Lavapies (línea 3), Atocha (línea 1)   Bus: 27, 34, 36, 41, 68, 69, 119   Renfe: Embajadores ";"";"1";"http://www.madrid.es/vgn-ext-templating/v/index.jsp?vgnextchannel=9e4c43db40317010VgnVCM100000dc0ca8c0RCRD&vgnextoid=c27f8899fc81c010VgnVCM1000000b205a0aRCRD";"VALENCIA";"RONDA";"V";"2";"";"";"";"";"MADRID";"MADRID";"28012";"EMBAJADORES";"CENTRO";"440732";"4473259";"40.40595710517701";"-3.699779793558763";"902 430 322                                 
";"915 063 876";"casaencendida@cajamadrid.es";"/contenido/entidadesYorganismos/MonumentosEdificiosArtisticos"; 
3350;"Claustro de San Jerónimo el Real (Los Jerónimos)";"";"";"";"Bus: 10 , 14 , 19 , 27 , 34 , 37 , 45";"";"0";"http://www.madrid.es/vgn-ext-templating/v/index.jsp?vgnextchannel=9e4c43db40317010VgnVCM100000dc0ca8c0RCRD&vgnextoid=8f947b503a71c010VgnVCM1000000b205a0aRCRD";"MORETO";"CALLE";"V";"4";"";"";"";"";"MADRID";"MADRID";"28014";"LOS JERONIMOS";"RETIRO";"441524";"4474184";"40.414346084679714";"-3.6905317543061407";"91 420 35 78&#13;
";"";"";"/contenido/entidadesYorganismos/MonumentosEdificiosArtisticos"; 
6469186;"Ermita de San Antonio de la Florida (Museo)";" Ermita dedicada a San Antonio de Padua y pequeño museo. Las pinturas murales que la decoran son de Francisco de Goya. Alberga los restos mortales del artista desde 1919. Para preservar sus pinturas, en 1929 se trasladó el culto a una ermita gemela construida a su lado, dejando el edificio original como museo. ";"  De martes a domingos y festivos de 9:30 a 20 horas.   Cerrado  los lunes, incluidos festivos y días 1 de enero, 1 de mayo y 25 de diciembre.   Último pase de visita:  20 minutos antes del cierre (el desalojo de las salas comenzará 10 minutos antes)   Por motivos de conservación, el aforo máximo es de 50 personas en el interior de la capilla.  Este horario y la apertura de salas pueden sufrir modificaciones, por favor, confírmelo en el teléfono de información del museo.  ";" Tienda, en la que se pueden adquirir las guías y publicaciones sobre la ermita editadas por el Museo y otros organismos públicos, así como catálogos y publicaciones de instituciones culturales del Ayuntamiento de Madrid. ";" Metro: Príncipe Pío (líneas 5, 10 y ramal Ópera - Príncipe Pío)  Bus: 41, 46 y 75 (Intercambiador Príncipe Pío)  Renfe: Príncipe Pío ";"";"0";"http://www.madrid.es/vgn-ext-templating/v/index.jsp?vgnextchannel=9e4c43db40317010VgnVCM100000dc0ca8c0RCRD&vgnextoid=75950204770e7310VgnVCM2000000c205a0aRCRD";"SAN ANTONIO DE LA FLORIDA";"GLORIETA";"V";"5";"";"";"";"";"MADRID";"MADRID";"28008";"CASA DE CAMPO";"MONCLOA-ARAVACA";"438548";"4475419";"40.425256682855846";"-3.725725718176111";"915 420 722 / 917 011 863                                                                                        
";"917 011 686";"sanantonio@madrid.es";"/contenido/entidadesYorganismos/MonumentosEdificiosArtisticos"; 
58353;"Espacio Fundación Telefónica";"";" De martes a domingo, de 10 a 20 horas.  Cerrado al público todos los lunes y los festivos 25 de diciembre y días 1 y 6 de enero. ";"  Accesos y espacios habilitados para personas con movilidad reducida, aseos adaptados y con cambiador de pañales, ascensor, zonas de descanso y silla de ruedas para uso en las salas.  Tabletas con guía multimedia de las exposiciones, disponibles en el mostrador de información.  Conexión WIFI.  ";" Metro: Gran Vía (líneas 1 y 5)  Bus: 1, 2, 46, 74, 146, 202 ";"  Teléfonos:    Visitas guiadas y talleres educativos: 915 225 645  Reserva de salas y eventos: 915 840 440 / 915 840 646    Correo electrónico:     Información general .   Visitas guiadas y talleres educativos .   Reserva de salas y eventos .   Tienda abierta de martes a domingo, de 10 a 20 horas. ";"1";"http://www.madrid.es/vgn-ext-templating/v/index.jsp?vgnextchannel=9e4c43db40317010VgnVCM100000dc0ca8c0RCRD&vgnextoid=87748ed67151c010VgnVCM2000000c205a0aRCRD";"FUENCARRAL";"CALLE";"V";"3";"";"";"";"";"MADRID";"MADRID";"28004";"UNIVERSIDAD";"CENTRO";"440590";"4474865";"40.42041458612889";"-3.7016034186955076";"915 808 700 (información general)";"";"";"/contenido/entidadesYorganismos/Museos"; 
6017808;"Fundación AMYC (Arte Moderno y Contemporáneo). Casa - Museo Fuente del Rey";"";" De lunes a viernes de 10 a 19 horas. Sábados y domingos cerrado.   Visitas  guiadas y concertadas con cita previa. ";" Siguiendo la iniciativa del mecenazgo de Francisco Daurella, en 2009 decide crear la Fundación  AMYC , para la que recupera, rehabilita y acondicona una casa de uso privado para transformala en Casa - Museo. En sus instalaciones acogerá diferentes salas expositivas y una sala polivalente para actos culturales. El eje principal de la colección de más de 250 obras, es dar una visión muy dinámica de lo sucedido entre fianles del siglo  XIX  y mediados del siglo  XX . ";"Bus: 161, I";"";"0";"http://www.madrid.es/vgn-ext-templating/v/index.jsp?vgnextchannel=9e4c43db40317010VgnVCM100000dc0ca8c0RCRD&vgnextoid=5c1260101310f210VgnVCM1000000b205a0aRCRD";"FUENTE DEL REY";"CALLE";"V";"11";"";"";"";"";"MADRID";"MADRID";"28023";"ARAVACA";"MONCLOA-ARAVACA";"434772";"4478804";"40.45546180290319";"-3.7705836264842576";"913 579 116";"913 575 989";"info@fundacionamyc.org";"/contenido/entidadesYorganismos/FundacionesCulturales"; 
3348;"Monasterio de las Descalzas Reales";" Convento fundado por la Princesa Juana de Austria, transformando un antiguo palacio de su madre Isabel de Portugal. ";" Sólo con visita guiada.    De martes a sábado de 10 a 14 horas y de 16 a 18:30 horas  Domingos y festivos, de 10 a 15 horas y tardes cerrado  Cierre de taquillas una hora antes  Cerrado: días 1, 6 de enero; Semana Santa (del 16 al 19 de abril, inclusive); 1 de mayo; 10 de noviembre; 24, 25 y 31 de diciembre de 2014  Abierto: 15 de mayo y 8 de diciembre de 2014  Abierto horario domingo: 2 de mayo; 19 de junio; 15 de agosto; 1 de noviembre y 6 de diciembre de 2014    Atención telefónica:    De lunes a sábados de 9:30 a 17 horas  Domingos y festivos de 9 a 14 horas  ";"";" Metro: Callao (líneas 3, 5) , Santo Domingo (línea 2) , Sol (líneas 1, 2, 3) Gran Vía (líneas 1, 5)  Bus: 1, 2, 3, 5, 15, 20, 25, 39, 40, 44, 46, 50, 51, 52, 53, 74, 75, 133, 146, 147, 148, 149, 150, 202 ";"";"0";"http://www.madrid.es/vgn-ext-templating/v/index.jsp?vgnextchannel=9e4c43db40317010VgnVCM100000dc0ca8c0RCRD&vgnextoid=12e113db5b71c010VgnVCM1000000b205a0aRCRD";"DESCALZAS";"PLAZA";"V";"3";"";"";"";"";"MADRID";"MADRID";"28013";"SOL";"CENTRO";"440197";"4474626";"40.418233359889484";"-3.706213134639163";"914 548 800 (Información, en Palacio Real)                                       
";"915 212 779";"";"/contenido/entidadesYorganismos/MonumentosEdificiosArtisticos"; 
5873478;"Museo ABC";"Centro de arte, dibujo e ilustración. ";"  De martes a sábado de 11 a 20 horas  Domingos de 10 a 14 horas  Festivos de 11 a 20 horas  Lunes cerrado   Visitas guiadas:  de martes a viernes (consultar horario en el teléfono del museo).  ";"";" Metro: San Bernardo (líneas 2 y 4), Noviciado (línea 2), Ventura Rodríguez (línea 3), Plaza de España (líneas 3 y 10)  Bus: M2, 3, 147 ";"";"0";"http://www.madrid.es/vgn-ext-templating/v/index.jsp?vgnextchannel=9e4c43db40317010VgnVCM100000dc0ca8c0RCRD&vgnextoid=f0103fee6537c210VgnVCM1000000b205a0aRCRD";"AMANIEL";"CALLE";"V";"29";"";"";"";"";"MADRID";"MADRID";"28015";"UNIVERSIDAD";"CENTRO";"439922";"4475646";"40.42740213531285";"-3.70955095379701";"917 588 379";"";"";"/contenido/entidadesYorganismos/Museos"; 
2067;"Museo Africano Mundo Negro";"Situado en los locales de los Misioneros de Madrid y abierto al público en 1985, se propone divulgar la cultura africana, promoviendo el conocimiento de la vida, de la historia y de las diversas culturas africanas. ";"   Grupos con cita previa : de lunes a sábado   Particulares  (visitas guiadas): domingos a las 11,30 horas   Cerrado : julio, agosto y septiembre  ";"";"Bus: 11, 70, 114, 122 ";"";"0";"http://www.madrid.es/vgn-ext-templating/v/index.jsp?vgnextchannel=9e4c43db40317010VgnVCM100000dc0ca8c0RCRD&vgnextoid=6ab8ef4d7f71c010VgnVCM1000000b205a0aRCRD";"ARTURO SORIA";"CALLE";"V";"101";"";"";"";"";"MADRID";"MADRID";"28043";"SAN JUAN BAUTISTA";"CIUDAD LINEAL";"444864";"4478056";"40.449455579055886";"-3.651503432956766";"914 152 412";"915 192 550";"";"/contenido/entidadesYorganismos/Museos"; 
2050;"Museo Arqueológico Nacional";" Construído en 1866 según proyectos de Jareño y Alarcón y terminado por Ruiz de Salces. Ocupa el mismo edificio que la Biblioteca Nacional. De estilo neoclásico. ";" De martes a sábado de 9:30 a 20 horas. Domingo y festivos de 9:30 a 15 horas.  Cerrado todos los lunes, 1 y 6 de enero, 1 de mayo y 24, 25 y 31 de diciembre y un festivo local (15 de mayo en 2014) ";"  Sistema de bucle inductivo de audio para personas con problemas de audición en la proyección audiovisual  y áreas de atención a público  Acceso para personas con movilidad reducida   Actividades culturales y didácticas   Visitas para grupos previa concertación de cita   Publicaciones   Servicio fotográfico  ";" Metro: Serrano (línea 4), Colón (línea 4), Velazquez (línea 4)  Bus: 1, 2, 5, 9, 14, 15, 19, 20, 21, 27, 28, 45, 51, 52, 53, 74, 146, 150  Renfe: Recoletos ";" Los grupos de cinco o más personas tendrán una reducción del 50% en el precio de la entrada, previa reserva.   Grupos escolares:  La visita de los grupos escolares es gratuita. El grupo debe contar con un profesor o persona responsable por cada 20 alumnos.  La guia multimedia es un dispositivo que mejora las prestaciones de las tradiciones audioguias, trasmitiendo la informacion sobre la exposición en diversos formatos: texto, imagen, vídeo y audio.  Ofrece un recorrido general con informac&iexcl;ón en español, inglés y lengua de signos, así como un recorrido específcio para personas con discapacidad visual ";"1";"http://www.madrid.es/vgn-ext-templating/v/index.jsp?vgnextchannel=9e4c43db40317010VgnVCM100000dc0ca8c0RCRD&vgnextoid=8fd8ef4d7f71c010VgnVCM1000000b205a0aRCRD";"SERRANO";"CALLE";"V";"13";"";"";"";"";"MADRID";"MADRID";"28001";"RECOLETOS";"SALAMANCA";"441708";"4475173";"40.42326842040792";"-3.6884539762461968";"915 777 912                              
                                              
";"";"sugerencias@man.es";"/contenido/entidadesYorganismos/Museos"; 
2072;"Museo Casa de la Moneda";" El Museo de la Fábrica Nacional de la Moneda y Timbre, contiene importantes colecciones numismáticas, grabados, dibujos, moldes y troqueles de los siglos  XVI ,  XVII  y  XVIII , cubriendo la historia de la moneda desde el siglo  VII a.C.  hasta nuestros dias. ";" De martes a viernes ininterrumpidamente de 10 a 17:30 horas. Sábados, domingos y festivos de 10 a 14 horas.  Cerrado los lunes, y los días 1, 4 y 5 de enero; 17, 18, 19 y 20 de abril; 1 y 2 de mayo; 19 de junio; 23, 24, 25 y 31 de diciembre. ";"El público puede acuñar una moneda durante su visita. Accesible a personas con minusvalía (física y sensorial). Visitas guiadas e introduce la lengua de signos para personas sordas ";" Metro: O&acute;Donnell (línea 6)  Bus: 2, 28, 30, 56, 71, 143, C, N6 ";"";"1";"http://www.madrid.es/vgn-ext-templating/v/index.jsp?vgnextchannel=9e4c43db40317010VgnVCM100000dc0ca8c0RCRD&vgnextoid=12f8ef4d7f71c010VgnVCM1000000b205a0aRCRD";"DOCTOR ESQUERDO";"CALLE";"V";"36";"";"";"";"";"MADRID";"MADRID";"28028";"GOYA";"SALAMANCA";"443345";"4475085";"40.42258896520152";"-3.6691501169061067";"915 666 544                 
";"915 666 809";"museo@fnmt.es";"/contenido/entidadesYorganismos/Museos"; 
4112;"Museo Cerralbo";" Este Palacio, construido entre 1883 y 1893, fue concebido como vivienda y como museo para sede de las obras de arte reunidas por los Marqueses de Cerralbo y sus hijos, los Marqueses de Villa Huerta, durante los numerosos viajes que realizaron por España y Europa.   Objetivos y Fines de la Fundación Cerralbo (en la misma sede)    Velar porque las colecciones no se disgreguen ni enajenen y permanezcan reunidas en su sede de Ventura Rodríguez.   Conceder premios y becas para artistas e investigadores y celebrar actos culturales.   Colaborar en la custodia, exhibición y mejora del patrimonio que el Estado heredó del Marqués, perpetuando así su memoria.   ";"  De martes a sábado de 9:30 a 15 horas  Jueves de 17 a 20 horas (apertura gratuita, excepto festivos)  Domingos y festivos de 10 a 15 horas  Lunes, cerrado  Jueves y Viernes Santo tienen el horario de los días festivos  Visitas guiadas, previa reserva, los martes y miércoles y, sin reserva, los jueves , viernes y sábados, a cargo de los voluntarios culturales de la Confederación de Aulas de la Tercera Edad  ";"  Biblioteca  Sala de Exposiciones  Sala de Conferencias  Gabinete dietético  Gabinete de dibujo y laboratorio de restauración  ";" Metro: Ventura Rodríguez (línea 3), Plaza de España (líneas 3 y 10)  Bus: 1, 2, 3, 25, 39, 44, 46, 74, 75, 133, 138, 148, 202, 749, C1, C2 ";"  Visitas guiadas gratuitas  con reserva previa los martes y miércoles (a partir de septiembre se podrá reservar para el últilmo trimestre del año), y sin reserva los jueves, viernes y sábados, a cargo de los voluntarios culturales de la Confederación de Aulas de la Tercera Edad. Esta actividad seguirá en curso hasta finales de junio. ";"1";"http://www.madrid.es/vgn-ext-templating/v/index.jsp?vgnextchannel=9e4c43db40317010VgnVCM100000dc0ca8c0RCRD&vgnextoid=a4efb0c40971c010VgnVCM1000000b205a0aRCRD";"VENTURA RODRIGUEZ";"CALLE";"V";"17";"";"";"";"";"MADRID";"MADRID";"28008";"ARGUELLES";"MONCLOA-ARAVACA";"439489";"4475246";"40.42376732078657";"-3.7146170388153497";"915 473 646 / 47";"915 591 171";"museo.cerralbo@mecd.es";"/contenido/entidadesYorganismos/Museos"; 
18176;"Museo Colecciones del Instituto de Crédito Oficial (ICO)";" El Museo Colecciones  ICO  abrió sus puertas al público en marzo de 1996. Su objetivo era difundir la colección de arte del Instituto de Crédito Oficial, una de las más importantes de arte español contemporáneo.  ";"  De martes a sábado: de 11 a 20 horas  Domingo y festivos: de 10 a 14 horas  Cerrado: todos los lunes del año (incluidos festivos) y los días 1 de enero, 1 de mayo y 25 de diciembre   Los días 24 y 31 de diciembre el Museo ICO permanecerá abierto de 10 a 14 horas.   ";"  Colecciones:  Suite Vollard, de Pablo Picasso - Pintura Española Contemporánea - Escultura Moderna Española con Dibujo.   Servicios:  además de exponer y difundir sus propios fondos, trabaja en la realización de exposiciones temporales que parten, principalmente, de tres líneas. La primera está dedicada a la realización de exposiciones de  arquitectura y diseño , tanto de arquitectos nacionales como de ámbito internacional. La segunda línea se dedica a la colaboración anual que el museo mantiene con el festival de fotografía  PHotoEspaña  y que ha permitido la exposición de reputados artistas como Man Ray o Dorothea Lange. Por último, la tercera de estas líneas está dedicada a la difusión de la  obra poco conocida de artistas presentes en las colecciones  ICO .  Esta política expositiva ha permitido conocer nuevas facetas de artistas como Susana Solano, Guillermo Pérez Villalta o Darío Urzay.  ";" Metro: Banco de España (línea 2) , Sevilla (línea 2)  Bus: 5, 9, 15, 10, 14, 27, 34, 37, 45, 51, 150 ";"";"1";"http://www.madrid.es/vgn-ext-templating/v/index.jsp?vgnextchannel=9e4c43db40317010VgnVCM100000dc0ca8c0RCRD&vgnextoid=2886444a2951c010VgnVCM2000000c205a0aRCRD";"ZORRILLA";"CALLE";"V";"3";"";"";"";"";"MADRID";"MADRID";"28014";"CORTES";"CENTRO";"440915";"4474456";"40.41675330128869";"-3.6977346235068373";"914 201 242";"";"museoico@ico.es";"/contenido/entidadesYorganismos/Museos"; 
