PK;NOMBRE;DESCRIPCION-ENTIDAD;HORARIO;EQUIPAMIENTO;TRANSPORTE;DESCRIPCION;ACCESIBILIDAD;CONTENT-URL;NOMBRE-VIA;CLASE-VIAL;TIPO-NUM;NUM;PLANTA;PUERTA;ESCALERAS;ORIENTACION;LOCALIDAD;PROVINCIA;CODIGO-POSTAL;BARRIO;DISTRITO;COORDENADA-X;COORDENADA-Y;LATITUD;LONGITUD;TELEFONO;FAX;EMAIL;TIPO;
174525;"Teatro Victoria";"Ofrece una cuidada selección de obras de teatro, comedias, monólogos, musicales y teatro infantil. Pretende rescatar obras clásicas intentando aportar en ellas las nuevas técnicas y aportaciones artísticas que ofrece la modernidad";"";"";" Metro: Noviciado (líneas 2, 3, 10)  Bus: 147 ";" Venta de entradas:   Taquilla  Por teléfono: 902 488 488  Internet:  www.entradas.com   ";"0";"http://www.madrid.es/vgn-ext-templating/v/index.jsp?vgnextchannel=9e4c43db40317010VgnVCM100000dc0ca8c0RCRD&vgnextoid=cbe08c89dd91f010VgnVCM2000000c205a0aRCRD";"PIZARRO";"CALLE";"V";"19";"";"";"";"";"MADRID";"MADRID";"28004";"UNIVERSIDAD";"CENTRO";"440251";"4475216";"40.423552238050114";"-3.7056321991333028";"915 228 730 ";"";"info@teatrovictoria.net";"/contenido/entidadesYorganismos/Teatros"; 
187464;"Teatro. ArtEspacio Plot Point";"  Sala alternativa  cuyos tamaño y versatilidad permite hacer espectáculos de pequeño formato variando la relación con el público conforme la propuesta dramática de la compañía. ";"";"Cursos de interpretación, guión, creación de personajes, dirección de actores, danza del vientre, cine: Videobooks a actores y profesionales. Castings para terceros por encargo";" Metro: Embajadores (Línea 3), Acacias (Línea 5)  Bus: 34, 36, 55, 60, 78, 116, 118, 119, 148 ";"";"0";"http://www.madrid.es/vgn-ext-templating/v/index.jsp?vgnextchannel=9e4c43db40317010VgnVCM100000dc0ca8c0RCRD&vgnextoid=ea2dd2bec675e010VgnVCM1000000b205a0aRCRD";"ERCILLA";"CALLE";"V";"29";"";"";"";"";"MADRID";"MADRID";"28005";"ACACIAS";"ARGANZUELA";"440536";"4472813";"40.40192531437177";"-3.7020477784084793";"914 749 765";"";"";"/contenido/entidadesYorganismos/Teatros"; 
168506;"Teatro. La Plaza de las Artes";"";"";"";"METRO: Embajadores &#13;BUS: 41 , 60 , 148 , C &#13;RENFE: Embajadores";"";"0";"http://www.madrid.es/vgn-ext-templating/v/index.jsp?vgnextchannel=9e4c43db40317010VgnVCM100000dc0ca8c0RCRD&vgnextoid=8b8de3914381c010VgnVCM1000000b205a0aRCRD";"PEÑA DE FRANCIA";"CALLE";"NUM";"13";"";"";"";"";"MADRID";"MADRID";"28005";"EMBAJADORES";"CENTRO";"440204";"4473392";"40.40711740791161";"-3.706014436418976";"91 530 81 59 (Oficina)";"";"laplaza@laplazadelasartes.com";"/contenido/entidadesYorganismos/Teatros"; 
5000655;"Teatros del Canal";"";"  Taquillas  (Calle Cea Bermúdez, 1): de 14:30 h a 21 horas., todos los días. La taquilla estará cerrada del 6 de julio al 5 de agosto (inclusive). ";"  Espacios escénicos:  los Teatros del Canal acogen dos grandes teatros abiertos al público, la Sala Roja y la Sala Verde, que, desde su apertura en febrero de 2009, mantienen una ocupación media del 70% y han recibido a más de 600.000 espectadores, más de 1.500 representaciones y  331 montajes. Además, los Teatros disponen de una Sala Negra o de Ensayos, de uso interno, cuyo escenario reproduce las dimensiones de la Sala Roja.    Sala Roja     Aforo: 863 localidades (platea, 595; anfiteatro, 248 y palcos, 20)  Aforo con foso de orquesta: 799 localidades     Sala Verde     Aforo máximo: 777 localidades   Configuración clásica: 441 localidades   Configuración con público en laterales de escenario: 605 localidades  Configuración con público en 4 lados del escenario: 777 localidades     Sala Negra     Superficie escenario: 22 x 8 metros  Aforo: 180 localidades    Centro Danza Canal:  es un  espacio artístico dedicado a la creación y difusión de la danza en todas sus variedades, lenguajes y estilos. Entre sus objetivos principales, se encuentra el de apoyar a las compañías de danza, dinamizando su actividad y ofreciendo el entorno de trabajo más apropiado a sus profesionales. ";" Metro: Canal (líneas 2, 7)  Bus: 3, 12, 37, 149 ";" Venta anticipada de localidades   El precio de las entradas es el mismo tanto en taquilla como en el resto de plataformas.    Internet: a  través de cada uno de los espectáculos en la web, seleccionando el botón rojo que indica Comprar.  http://www.teatroscanal.com/  También hay entradas disponibles a través de la página de entradas.ibercaja.es. Las compras con Tarjeta Ibercaja estarán exentas de gastos de distribución.   Taquillas de los Teatros del Canal:  en horario de 14:30  a 21 horas. (La taquilla permanecerá cerrada entre el 7 de julio y el 6 de agosto). Descuentos habituales: mayores de 65 años, jóvenes con Carné Joven (en ambos casos es imprescindible la acreditación) y grupos. Teléfonos de información y reserva de grupos: (+34) 91 308 99 99.  Consultar en taquilla otros posibles descuentos.   Atención Tarjeta Regalo Canal (TRC): (+34) 91 308 99 56 / 58 (de 10:15  a 14.30 horas)  correo electrónico:teatroscanal@teatroscanal.comtradas     Cajeros Ibercaja:  las localidades también pueden adquirirse en la red de cajeros Ibercaja. Para resolver cualquier duda, el teléfono de información es 976 201 072, y para llamadas desde el extranjero el teléfono es: (+34)  976 201 072.  ";"1";"http://www.madrid.es/vgn-ext-templating/v/index.jsp?vgnextchannel=9e4c43db40317010VgnVCM100000dc0ca8c0RCRD&vgnextoid=8f63986ba58bc110VgnVCM1000000b205a0aRCRD";"CEA BERMUDEZ";"CALLE";"V";"1";"";"";"";"";"MADRID";"MADRID";"28003";"ARAPILES";"CHAMBERI";"440312";"4476879";"40.438519654203546";"-3.7050694291186463";"913 089 999  / 913 089 950           
           
";"";"teatroscanal@teatroscanal.com";"/contenido/entidadesYorganismos/Teatros"; 

